PubmedID,Title,Publication Date,Non-academic Author(s),Company Affiliation(s),Corresponding Author Email
40573979,SARS-CoV-2 Receptor Binding Domain (RBD) Protein-Protein Conjugate Induces Similar or Better Antibody Responses as Spike mRNA in Rhesus Macaques.,2025,Puthupparampil V Scaria; Christopher G Rowe; Jonathan P Renn; Nada Alani; Pinar Kemanli; Sachy Orr-Gonzalez; Lynn E Lambert; Kayode Adeyemi; Justin Y A Doritchamou; Emma K Barnafo; Kelly M Rausch; Liya Muslinkina; Robert D Morrison; Andrew Lees; Patrick E Duffy,"Laboratory of Malaria Immunology and Vaccinology, National Institute of Allergy and Infectious Diseases, National Institutes of Health, 29 Lincoln Drive, Building 29B, Bethesda, MD 20892, USA.; Laboratory of Malaria Immunology and Vaccinology, National Institute of Allergy and Infectious Diseases, National Institutes of Health, 29 Lincoln Drive, Building 29B, Bethesda, MD 20892, USA.; Laboratory of Malaria Immunology and Vaccinology, National Institute of Allergy and Infectious Diseases, National Institutes of Health, 29 Lincoln Drive, Building 29B, Bethesda, MD 20892, USA.; Laboratory of Malaria Immunology and Vaccinology, National Institute of Allergy and Infectious Diseases, National Institutes of Health, 29 Lincoln Drive, Building 29B, Bethesda, MD 20892, USA.; Laboratory of Malaria Immunology and Vaccinology, National Institute of Allergy and Infectious Diseases, National Institutes of Health, 29 Lincoln Drive, Building 29B, Bethesda, MD 20892, USA.; Laboratory of Malaria Immunology and Vaccinology, National Institute of Allergy and Infectious Diseases, National Institutes of Health, 29 Lincoln Drive, Building 29B, Bethesda, MD 20892, USA.; Laboratory of Malaria Immunology and Vaccinology, National Institute of Allergy and Infectious Diseases, National Institutes of Health, 29 Lincoln Drive, Building 29B, Bethesda, MD 20892, USA.; Laboratory of Malaria Immunology and Vaccinology, National Institute of Allergy and Infectious Diseases, National Institutes of Health, 29 Lincoln Drive, Building 29B, Bethesda, MD 20892, USA.; Laboratory of Malaria Immunology and Vaccinology, National Institute of Allergy and Infectious Diseases, National Institutes of Health, 29 Lincoln Drive, Building 29B, Bethesda, MD 20892, USA.; Laboratory of Malaria Immunology and Vaccinology, National Institute of Allergy and Infectious Diseases, National Institutes of Health, 29 Lincoln Drive, Building 29B, Bethesda, MD 20892, USA.; Laboratory of Malaria Immunology and Vaccinology, National Institute of Allergy and Infectious Diseases, National Institutes of Health, 29 Lincoln Drive, Building 29B, Bethesda, MD 20892, USA.; Structural Biology Section, Research Technologies Branch, National Institute of Allergy and Infectious Diseases, National Institutes of Health, Bethesda, MD 20892, USA.; Laboratory of Malaria Immunology and Vaccinology, National Institute of Allergy and Infectious Diseases, National Institutes of Health, 29 Lincoln Drive, Building 29B, Bethesda, MD 20892, USA.; Fina BioSolutions LLC, 9430 Key West Ave. Suite 200, Rockville, MD 20850, USA.; Laboratory of Malaria Immunology and Vaccinology, National Institute of Allergy and Infectious Diseases, National Institutes of Health, 29 Lincoln Drive, Building 29B, Bethesda, MD 20892, USA.",
40573959,Development of an Influenza/COVID-19 Combination mRNA Vaccine Containing a Novel Multivalent Antigen Design That Enhances Immunogenicity of Influenza Virus B Hemagglutinins.,2025,Elena Thornhill-Wadolowski; Dana L Ruter; Feng Yan; Mayur Gajera; Evan Kurt; Labannya Samanta; Kimberlin Leigh; Jianbo Zhu; Zhijun Guo; Zihao Wang; Yuanqing Liu; Jaewoo Lee; Marcin Bugno,"Immorna Biotherapeutics, Inc., Morrisville, NC 27560, USA.; Immorna Biotherapeutics, Inc., Morrisville, NC 27560, USA.; Immorna Biotherapeutics, Inc., Morrisville, NC 27560, USA.; Immorna Biotherapeutics, Inc., Morrisville, NC 27560, USA.; Immorna Biotherapeutics, Inc., Morrisville, NC 27560, USA.; Immorna Biotherapeutics, Inc., Morrisville, NC 27560, USA.; Immorna Biotherapeutics, Inc., Morrisville, NC 27560, USA.; Immorna (Hangzhou) Biotechnology, Co., Ltd., Hangzhou 311215, China.; Immorna (Hangzhou) Biotechnology, Co., Ltd., Hangzhou 311215, China.; Immorna (Hangzhou) Biotechnology, Co., Ltd., Hangzhou 311215, China.; Immorna (Shanghai) Biotechnology, Co., Ltd., Shanghai 201108, China.; Immorna Biotherapeutics, Inc., Morrisville, NC 27560, USA.; Immorna Biotherapeutics, Inc., Morrisville, NC 27560, USA.",
40573913,A Poly-Lysine-Based RBD Mucosal Vaccine Induces Potent Antibody Responses in Mice.,2025,Huifang Xu; Han Wang; Peng Sun; Tiantian Wang; Bin Zhang; Xuchen Hou; Jun Wu; Bo Liu,"Laboratory of Advanced Biotechnology, Beijing Institute of Biotechnology, 20 Dongdajie Street, Fengtai District, Beijing 100071, China.; Laboratory of Advanced Biotechnology, Beijing Institute of Biotechnology, 20 Dongdajie Street, Fengtai District, Beijing 100071, China.; Laboratory of Advanced Biotechnology, Beijing Institute of Biotechnology, 20 Dongdajie Street, Fengtai District, Beijing 100071, China.; Laboratory of Advanced Biotechnology, Beijing Institute of Biotechnology, 20 Dongdajie Street, Fengtai District, Beijing 100071, China.; Laboratory of Advanced Biotechnology, Beijing Institute of Biotechnology, 20 Dongdajie Street, Fengtai District, Beijing 100071, China.; Laboratory of Advanced Biotechnology, Beijing Institute of Biotechnology, 20 Dongdajie Street, Fengtai District, Beijing 100071, China.; Laboratory of Advanced Biotechnology, Beijing Institute of Biotechnology, 20 Dongdajie Street, Fengtai District, Beijing 100071, China.; Laboratory of Advanced Biotechnology, Beijing Institute of Biotechnology, 20 Dongdajie Street, Fengtai District, Beijing 100071, China.",
40573904,"Safety, Tolerability, and Immunogenicity of a DNA Vaccine (pGX9501) Against SARS-CoV-2 in Healthy Volunteers: A Single-Center, Randomized, Double-Blind, Placebo-Controlled, and Dose-Ranging Phase I Trial.",2025,Xin Cheng; Shuo Wang; Yu Xia; Xuefen Huai; Zhenning Xiu; Jiarong Wang; Yue He; Bin Wang,"Advaccine Biopharmaceuticals Suzhou Co., Ltd., Suzhou 215000, China.; Advaccine Biopharmaceuticals Suzhou Co., Ltd., Suzhou 215000, China.; Advaccine Biopharmaceuticals Suzhou Co., Ltd., Suzhou 215000, China.; Advaccine Biopharmaceuticals Suzhou Co., Ltd., Suzhou 215000, China.; Advaccine Biopharmaceuticals Suzhou Co., Ltd., Suzhou 215000, China.; Advaccine Biopharmaceuticals Suzhou Co., Ltd., Suzhou 215000, China.; Advaccine Biopharmaceuticals Suzhou Co., Ltd., Suzhou 215000, China.; Advaccine Biopharmaceuticals Suzhou Co., Ltd., Suzhou 215000, China.",
40573439,Humoral and Cellular Immune Responses to SARS-CoV-2 in Participants with Head and Neck Cancer.,2025,Elena Codrici,"Biochemistry-Proteomics Department, Victor Babes National Institute of Pathology, 050096 Bucharest, Romania.",
