PubmedID,Title,Publication Date,Non-academic Author(s),Company Affiliation(s),Corresponding Author Email
40634526,The role of intestinal microbiota in the humoral response to SARS-CoV-2 after mRNA-1273 vaccination.,2025,Abel Garcia-Diaz; Antonio José Cabrera-Serrano; Juan Sainz,"Instituto de Investigación Biosanitaria de Granada (ibs.GRANADA), 18012, Granada, Spain.; Instituto de Investigación Biosanitaria de Granada (ibs.GRANADA), 18012, Granada, Spain.; Instituto de Investigación Biosanitaria de Granada (ibs.GRANADA), 18012, Granada, Spain.",
40632736,Forecasting high-risk areas for dengue outbreaks in China: A trend analysis of Aedes albopictus and Aedes aegypti distributions from 2014 to 2030.,2025,Qi Chen; Xuhua Guan,"Hubei Provincial Center for Disease Control and Prevention, Wuhan, China.; Hubei Provincial Center for Disease Control and Prevention, Wuhan, China.",
40632654,Structural serology of polyclonal antibody responses to mRNA-1273 and NVX-CoV2373 COVID-19 vaccines.,2025,Sandhya Bangaru; Abigail M Jackson; Jeffrey Copps; Monica L Fernández-Quintero; Jonathan L Torres; Sara T Richey; Bartek Nogal; Leigh M Sewall; Alba Torrents de la Peña; Asma Rehman; Mimi Guebre-Xabier; Bethany Girard; Rituparna Das; Darin K Edwards; Nita Patel; Gale Smith; Andrew B Ward,"Department of Integrative Structural and Computational Biology, The Scripps Research Institute, La Jolla, CA 92037, USA.; Department of Integrative Structural and Computational Biology, The Scripps Research Institute, La Jolla, CA 92037, USA.; Department of Integrative Structural and Computational Biology, The Scripps Research Institute, La Jolla, CA 92037, USA.; Department of Integrative Structural and Computational Biology, The Scripps Research Institute, La Jolla, CA 92037, USA.; Department of Integrative Structural and Computational Biology, The Scripps Research Institute, La Jolla, CA 92037, USA.; Department of Integrative Structural and Computational Biology, The Scripps Research Institute, La Jolla, CA 92037, USA.; Department of Integrative Structural and Computational Biology, The Scripps Research Institute, La Jolla, CA 92037, USA.; Department of Integrative Structural and Computational Biology, The Scripps Research Institute, La Jolla, CA 92037, USA.; Department of Integrative Structural and Computational Biology, The Scripps Research Institute, La Jolla, CA 92037, USA.; Novavax, Inc., 21 Firstfield Road, Gaithersburg, MD 20878, USA.; Novavax, Inc., 21 Firstfield Road, Gaithersburg, MD 20878, USA.; Moderna, Inc., Cambridge, MA 02142, USA.; Moderna, Inc., Cambridge, MA 02142, USA.; Moderna, Inc., Cambridge, MA 02142, USA.; Novavax, Inc., 21 Firstfield Road, Gaithersburg, MD 20878, USA.; Novavax, Inc., 21 Firstfield Road, Gaithersburg, MD 20878, USA.; Department of Integrative Structural and Computational Biology, The Scripps Research Institute, La Jolla, CA 92037, USA. Electronic address: andrew@scripps.edu.",andrew@scripps.edu
40631700,Dynamics of Crossed Acquired Immunity Against SARS-CoV-2 Variants: From Vaccine to Hybrid Immunity in China.,2025,Bihao Wu; Rui Gong,"CAS Key Laboratory of Special Pathogens and Biosafety, Wuhan Institute of Virology, Center for Biosafety Mega-Science, Chinese Academy of Sciences, Wuhan, Hubei, China.; CAS Key Laboratory of Special Pathogens and Biosafety, Wuhan Institute of Virology, Center for Biosafety Mega-Science, Chinese Academy of Sciences, Wuhan, Hubei, China.",
40630398,"Perceptions of the safety, development, and approval process of severe acute respiratory syndrome coronavirus 2 (SARS-CoV-2) vaccines among individuals with Affordable Care Act health insurance in Central Texas at the time of initial vaccine availability.",2025,Carlos Lopez Bray; Naomi Tamez; Wesley Durkalski; John R Litaker,"Office of Population Health, Sendero Health Plans, Inc., Austin, TX, United States.; Office of Population Health, Sendero Health Plans, Inc., Austin, TX, United States.; Former Chief Executive Officer, Sendero Health Plans, Inc., Austin, TX, United States.; Office of Population Health and Science, The Litaker Group, LLC, Austin, TX, United States.",
40628904,Global pneumococcal sequence cluster lineage for invasive pneumococcal isolates in Denmark from summer 2019 to 2023.,2025,Thor Bech Johannesen; Marc Stegger,"Department for Sequencing and Bioinformatics, Statens Serum Institut, Copenhagen, Denmark.; Department for Sequencing and Bioinformatics, Statens Serum Institut, Copenhagen, Denmark.",
40628697,In silico genomic surveillance by CoVerage predicts and characterizes SARS-CoV-2 variants of interest.,2025,Katrina Norwood; Zhi-Luo Deng; Susanne Reimering; Gary Robertson; Mohammad-Hadi Foroughmand-Araabi; Sama Goliaei; Frank Klawonn; Alice C McHardy,"Computational Biology of Infection Research, Helmholtz Centre for Infection Research, Braunschweig, Germany.; Computational Biology of Infection Research, Helmholtz Centre for Infection Research, Braunschweig, Germany.; Computational Biology of Infection Research, Helmholtz Centre for Infection Research, Braunschweig, Germany.; Computational Biology of Infection Research, Helmholtz Centre for Infection Research, Braunschweig, Germany.; Computational Biology of Infection Research, Helmholtz Centre for Infection Research, Braunschweig, Germany.; Computational Biology of Infection Research, Helmholtz Centre for Infection Research, Braunschweig, Germany.; Biostatistics, Helmholtz Centre for Infection Research, Braunschweig, Germany.; Computational Biology of Infection Research, Helmholtz Centre for Infection Research, Braunschweig, Germany. amc14@helmholtz-hzi.de.",amc14@helmholtz-hzi.de
40617588,Adaptive immune responses to SARS-CoV-2 in DMARD-treated patients with chronic inflammatory rheumatisms.,2025,Thomas Bruneau; Helene Péré,"Service de Microbiologie (Unité de virologie), Hôpital Européen Georges Pompidou, Paris, France.; Service de Microbiologie (Unité de virologie), Hôpital Européen Georges Pompidou, Paris, France.",
40617534,Scalable approach for Coronavirus-like particles making based on the Spike protein using Sf9 cells.,2025,Luis Giovani Oliveira Guardalini; Thaissa Consoni Bernardino; Jaci Leme; Henrique Coelho de Oliveira; Soraia Attie Calil Jorge,"Laboratório de Biotecnologia Viral, Instituto Butantan, Av. Vital Brasil, 1500, CEP 05503-900, São Paulo, SP-Brazil.; Laboratório de Biotecnologia Viral, Instituto Butantan, Av. Vital Brasil, 1500, CEP 05503-900, São Paulo, SP-Brazil.; Laboratório de Biotecnologia Viral, Instituto Butantan, Av. Vital Brasil, 1500, CEP 05503-900, São Paulo, SP-Brazil.; Eppendorf do Brasil Ltda. Rua Presidente Antônio Candido, 80, CEP 05083-060, São Paulo, SP-Brazil.; Laboratório de Biotecnologia Viral, Instituto Butantan, Av. Vital Brasil, 1500, CEP 05503-900, São Paulo, SP-Brazil. Electronic address: soraia.jorge@butantan.gov.br.",soraia.jorge@butantan.gov.br
40616520,Discovery of the Clinical Candidate <b>S-892216</b>: A Second-Generation of SARS-CoV-2 3CL Protease Inhibitor for Treating COVID-19.,2025,Yuto Unoh; Keiichiro Hirai; Shota Uehara; Sho Kawashima; Haruaki Nobori; Jun Sato; Hiromitsu Shibayama; Akihiro Hori; Kenji Nakahara; Kana Kurahashi; Masayuki Takamatsu; Shiho Yamamoto; Qianhui Zhang; Miki Tanimura; Reiko Dodo; Yuki Maruyama; Ryosuke Watari; Tetsuya Miyano; Teruhisa Kato; Takafumi Sato; Yuki Tachibana,"Shionogi Pharmaceutical Research Center, 3-1-1 Futaba-cho, Toyonaka, Osaka 561-0825, Japan.; Shionogi Pharmaceutical Research Center, 3-1-1 Futaba-cho, Toyonaka, Osaka 561-0825, Japan.; Shionogi Pharmaceutical Research Center, 3-1-1 Futaba-cho, Toyonaka, Osaka 561-0825, Japan.; Shionogi Pharmaceutical Research Center, 3-1-1 Futaba-cho, Toyonaka, Osaka 561-0825, Japan.; Shionogi Pharmaceutical Research Center, 3-1-1 Futaba-cho, Toyonaka, Osaka 561-0825, Japan.; Shionogi Pharmaceutical Research Center, 3-1-1 Futaba-cho, Toyonaka, Osaka 561-0825, Japan.; Shionogi Pharmaceutical Research Center, 3-1-1 Futaba-cho, Toyonaka, Osaka 561-0825, Japan.; Shionogi Pharmaceutical Research Center, 3-1-1 Futaba-cho, Toyonaka, Osaka 561-0825, Japan.; Shionogi Pharmaceutical Research Center, 3-1-1 Futaba-cho, Toyonaka, Osaka 561-0825, Japan.; Shionogi Pharmaceutical Research Center, 3-1-1 Futaba-cho, Toyonaka, Osaka 561-0825, Japan.; Shionogi Pharmaceutical Research Center, 3-1-1 Futaba-cho, Toyonaka, Osaka 561-0825, Japan.; Shionogi Pharmaceutical Research Center, 3-1-1 Futaba-cho, Toyonaka, Osaka 561-0825, Japan.; Shionogi Pharmaceutical Research Center, 3-1-1 Futaba-cho, Toyonaka, Osaka 561-0825, Japan.; Shionogi Pharmaceutical Research Center, 3-1-1 Futaba-cho, Toyonaka, Osaka 561-0825, Japan.; Shionogi Pharmaceutical Research Center, 3-1-1 Futaba-cho, Toyonaka, Osaka 561-0825, Japan.; Shionogi Pharmaceutical Research Center, 3-1-1 Futaba-cho, Toyonaka, Osaka 561-0825, Japan.; Shionogi Pharmaceutical Research Center, 3-1-1 Futaba-cho, Toyonaka, Osaka 561-0825, Japan.; Shionogi Pharmaceutical Research Center, 3-1-1 Futaba-cho, Toyonaka, Osaka 561-0825, Japan.; Shionogi Pharmaceutical Research Center, 3-1-1 Futaba-cho, Toyonaka, Osaka 561-0825, Japan.; Shionogi Pharmaceutical Research Center, 3-1-1 Futaba-cho, Toyonaka, Osaka 561-0825, Japan.; Shionogi Pharmaceutical Research Center, 3-1-1 Futaba-cho, Toyonaka, Osaka 561-0825, Japan.",
40614182,Safety and immunogenicity of intranasal parainfluenza virus type 5 (PIV5)-vectored COVID-19 vaccine in adults and teens in an open-label phase 1 trial.,2025,Hong Jin; Kristeene Knopp; Henry Radziewicz; Marinka Tellier; Zhuo Li; Maria Cristina Gingerich; Samuel Wu; Biao He,"CyanVac LLC, 111 Riverbend Rd, Athens, GA 30602, USA.; CyanVac LLC, 111 Riverbend Rd, Athens, GA 30602, USA.; CyanVac LLC, 111 Riverbend Rd, Athens, GA 30602, USA.; CyanVac LLC, 111 Riverbend Rd, Athens, GA 30602, USA.; CyanVac LLC, 111 Riverbend Rd, Athens, GA 30602, USA.; CyanVac LLC, 111 Riverbend Rd, Athens, GA 30602, USA.; CyanVac LLC, 111 Riverbend Rd, Athens, GA 30602, USA.; CyanVac LLC, 111 Riverbend Rd, Athens, GA 30602, USA.",
40613010,COVID-19 Hospitalization and Mortality Trends Among US Dialysis Patients by Race/Ethnicity and Vaccination Status.,2025,Monica M Shieu; Nien Chen Li; Harold J Manley; Antonia Harford; Doug Johnson; Eduardo K Lacson,"Quality Analytics, Dialysis Clinic Inc., Nashville, TN.; Quality Analytics, Dialysis Clinic Inc., Nashville, TN.; Quality Analytics, Dialysis Clinic Inc., Nashville, TN.; Quality Analytics, Dialysis Clinic Inc., Nashville, TN.; Quality Analytics, Dialysis Clinic Inc., Nashville, TN.; Quality Analytics, Dialysis Clinic Inc., Nashville, TN.",
40611257,Targeting heptad repeats and fusion peptide: nanoparticle vaccine elicits mucosal immune response against SARS-CoV-2 variants.,2025,Baisheng Li; Huan Zhang,"Guangdong Provincial Center for Disease Control and Prevention, Guangzhou, 511430, China.; Guangdong Provincial Center for Disease Control and Prevention, Guangzhou, 511430, China.",
40609232,The COVID-19 vaccination health literacy questionnaire (CVHL-Q): Design and validation according to classic psychometric and Rasch analyses.,2025,María Romay-Barja,"National Centre of Tropical Medicine, Carlos III Health Institute, Madrid, Spain; Centre for Biomedical Research in Infectious Diseases Network (CIBERINFEC), Madrid, Spain.",
40608426,MICBG406A polymorphism reduces risk of mechanical ventilation and death during viral acute lung injury.,2025,Oscar A Aguilar,"Department of Microbiology and Immunology, UCSF, San Francisco, United States of America.",
40604011,Age associated SARS-CoV-2 immune responses provide insights into population immunity over four years since the COVID-19 pandemic.,2025,Thaneeya Duangchinda; Pattarakul Pakchotanon,"Molecular Biology of Dengue and Flaviviruses Research Team, National Center for Genetic Engineering and Biotechnology (BIOTEC), National Science and Development Agency, NSTDA, Pathum Thani, 12120, Thailand.; Molecular Biology of Dengue and Flaviviruses Research Team, National Center for Genetic Engineering and Biotechnology (BIOTEC), National Science and Development Agency, NSTDA, Pathum Thani, 12120, Thailand.",
40599452,Safflower-Derived Cationic Lipid Nanoparticles: Potential Impact on the Delivery of SARS-CoV-2 MRNA Transcripts.,2024,H Nasr Isfahani; A A Hariri; Z Sharifnia; A Moradi,"Biotechnology Department, Behyaar Sanaat Sepahan Company, Isfahan, Iran.; Biotechnology Department, Behyaar Sanaat Sepahan Company, Isfahan, Iran.; Biotechnology Department, Behyaar Sanaat Sepahan Company, Isfahan, Iran.; Biotechnology Department, Behyaar Sanaat Sepahan Company, Isfahan, Iran.",
40597698,Over- and under-estimation of vaccine effectiveness.,2025,Hilla De-Leon; Dvir Aran,"Faculty of Biology, Technion-Israel Institute of Technology, Technion-Israel Institute of Technology, 21 Sderot Rose, Haifa, 3095230, Israel.; Faculty of Biology, Technion-Israel Institute of Technology, Technion-Israel Institute of Technology, 21 Sderot Rose, Haifa, 3095230, Israel. dviraran@technion.ac.il.",dviraran@technion.ac.il
40594764,Efficacy and safety of a novel multivalent mRNA vaccine against SARS-CoV-2 in experimental animals.,2025,Woo Ghil Lee; Seong In Jeong; Ji Young Song; In-Chul Lee; Hyung-Jun Kwon; Young-Bae Ryu; Kyong-Cheol Ko,"Rnagene Co., Ltd., 603-605, 7 Beobwon-ro 6-gil, Songpa-gu, Seoul-si, 05855, Republic of Korea.; Rnagene Co., Ltd., 603-605, 7 Beobwon-ro 6-gil, Songpa-gu, Seoul-si, 05855, Republic of Korea.; Rnagene Co., Ltd., 603-605, 7 Beobwon-ro 6-gil, Songpa-gu, Seoul-si, 05855, Republic of Korea.; Korea Research Institute of Bioscience and Biotechnology, Functional Biomaterial Research Center, 181 Ipsin-gil, Jeongeup-si, Republic of Korea.; Korea Research Institute of Bioscience and Biotechnology, Functional Biomaterial Research Center, 181 Ipsin-gil, Jeongeup-si, Republic of Korea.; Korea Research Institute of Bioscience and Biotechnology, Functional Biomaterial Research Center, 181 Ipsin-gil, Jeongeup-si, Republic of Korea.; Korea Research Institute of Bioscience and Biotechnology, Korea Preclinical Evaluation Center, 125 Gwahak-ro, Yuseong-gu, Daejeon, 34141, South Korea.",
40594178,Tough talks COVID-19 (TT-C) digital health intervention: multistate randomized controlled trial.,2025,Margo Adams Larsen,"Virtually Better, Inc, Decatur, GA, USA.",
40593765,Systems vaccinology identifies immunological correlates of SARS-CoV-2 vaccine response in solid organ transplant recipients.,2025,Julika Neumann; Teresa Prezzemolo; Margaux Gerbaux; Leoni Bücken; Mathijs Willemsen; Stephanie Humblet-Baron,"KU Leuven, Department of Microbiology, Immunology and Transplantation, Leuven, Belgium.; KU Leuven, Department of Microbiology, Immunology and Transplantation, Leuven, Belgium.; KU Leuven, Department of Microbiology, Immunology and Transplantation, Leuven, Belgium.; KU Leuven, Department of Microbiology, Immunology and Transplantation, Leuven, Belgium.; KU Leuven, Department of Microbiology, Immunology and Transplantation, Leuven, Belgium.; KU Leuven, Department of Microbiology, Immunology and Transplantation, Leuven, Belgium. stephanie.humbletbaron@kuleuven.be.",stephanie.humbletbaron@kuleuven.be
40591130,Safety and Immunogenicity of Monovalent Omicron KP.2-Adapted BNT162b2 COVID-19 Vaccine in Adults: Single-Arm Substudy from a Phase 2/3 Trial.,2025,Oyeniyi Diya; Juleen Gayed; Federico Mensa; Mark Cutler; Todd Belanger; David Cooper; Özlem Türeci; Uǧur Şahin; Kena A Swanson; Kayvon Modjarrad; Annaliesa S Anderson; Alejandra Gurtman; Nicholas Kitchin,"Vaccine Research and Development, Pfizer Ltd, Marlow, UK.; Vaccine Research and Development, Pfizer Ltd, Marlow, UK. juleen.gayed@pfizer.com.; BioNTech, Mainz, Germany.; Vaccine Research and Development, Pfizer Inc, Pearl River, NY, USA.; Vaccine Research and Development, Pfizer Inc, Pearl River, NY, USA.; Vaccine Research and Development, Pfizer Inc, Pearl River, NY, USA.; BioNTech, Mainz, Germany.; BioNTech, Mainz, Germany.; Vaccine Research and Development, Pfizer Inc, Pearl River, NY, USA.; Vaccine Research and Development, Pfizer Inc, Pearl River, NY, USA.; Vaccine Research and Development, Pfizer Inc, Pearl River, NY, USA.; Vaccine Research and Development, Pfizer Inc, Pearl River, NY, USA.; Vaccine Research and Development, Pfizer Ltd, Marlow, UK.",juleen.gayed@pfizer.com
40589754,A novel and safe SmartCap<sup>®</sup> SC101 to develop the COVID-19 mRNA vaccine STP2104 inducing potent immune responses in humans.,2025,Rachel Kim; Tae-Gi Uhm; Jisu Kim; Dayeon Woo; Uk-Il Kim; Xue Meng; Byounggu Yang; Suhyeon Kim; Heejene Kim; Jonghyeon Kim; Joo-Young Lee; Byungkyun Kim; Dongheon Cho; Duckho Chang; Young-Hwan Cho; Kanghyun Choi; Hoon-Woo Lee; Jieun Bang; Elizabeth Hellström; Kyungjin Kim; Joo-Sung Yang,"R&D Center, ST Pharm Co., Ltd., Seoul, Republic of Korea.; R&D Center, ST Pharm Co., Ltd., Seoul, Republic of Korea.; R&D Center, ST Pharm Co., Ltd., Seoul, Republic of Korea.; R&D Center, ST Pharm Co., Ltd., Seoul, Republic of Korea.; R&D Center, ST Pharm Co., Ltd., Seoul, Republic of Korea.; R&D Center, ST Pharm Co., Ltd., Seoul, Republic of Korea.; R&D Center, ST Pharm Co., Ltd., Seoul, Republic of Korea.; R&D Center, ST Pharm Co., Ltd., Seoul, Republic of Korea.; R&D Center, ST Pharm Co., Ltd., Seoul, Republic of Korea.; R&D Center, ST Pharm Co., Ltd., Seoul, Republic of Korea.; R&D Center, ST Pharm Co., Ltd., Seoul, Republic of Korea.; R&D Center, ST Pharm Co., Ltd., Seoul, Republic of Korea.; R&D Center, ST Pharm Co., Ltd., Seoul, Republic of Korea.; R&D Center, ST Pharm Co., Ltd., Seoul, Republic of Korea.; R&D Center, ST Pharm Co., Ltd., Seoul, Republic of Korea.; R&D Center, ST Pharm Co., Ltd., Seoul, Republic of Korea.; R&D Center, ST Pharm Co., Ltd., Seoul, Republic of Korea.; R&D Center, ST Pharm Co., Ltd., Seoul, Republic of Korea.; Be Part Research (PTY) Ltd., Paarl, South Africa.; R&D Center, ST Pharm Co., Ltd., Seoul, Republic of Korea.; R&D Center, ST Pharm Co., Ltd., Seoul, Republic of Korea.",
40589223,Editorial: The 2025 World Health Assembly Pandemic Agreement and the 2024 Amendments to the International Health Regulations Combine for Pandemic Preparedness and Response.,2025,Dinah V Parums,"Science Editor, Medical Science Monitor, International Scientific Information, Inc., Melville, NY, USA.",
40585204,Empiric Azithromycin in COVID-19 Impacts the Respiratory Microbiome and Antimicrobial Resistome without Anti-inflammatory Benefit.,2025,Abigail Glascock,Chan Zuckerberg Biohub.,
40584171,Emerging RNA-centric technologies to probe RNA-protein interactions: importance in decoding the life cycle of positive sense single strand RNA viruses and antiviral discovery.,2025,Sreemoyee Ghosh; Shivam Kumar; Rohit Verma; Shabnam Ansari; Samrat Chatterjee; Milan Surjit,"Virology Laboratory, Centre for Virus Research, Therapeutics and Vaccines, Translational Health Science and Technology Institute, NCR Biotech Science Cluster, Faridabad, Haryana, India.; Complex Analysis Group, Computational and Mathematical Biology Centre, Translational Health Science and Technology Institute, NCR Biotech Science Cluster, Faridabad, Haryana, India.; Virology Laboratory, Centre for Virus Research, Therapeutics and Vaccines, Translational Health Science and Technology Institute, NCR Biotech Science Cluster, Faridabad, Haryana, India.; Virology Laboratory, Centre for Virus Research, Therapeutics and Vaccines, Translational Health Science and Technology Institute, NCR Biotech Science Cluster, Faridabad, Haryana, India.; Complex Analysis Group, Computational and Mathematical Biology Centre, Translational Health Science and Technology Institute, NCR Biotech Science Cluster, Faridabad, Haryana, India.; Virology Laboratory, Centre for Virus Research, Therapeutics and Vaccines, Translational Health Science and Technology Institute, NCR Biotech Science Cluster, Faridabad, Haryana, India.",
40581329,Anti-spike IgG4 and Fc effector responses: The impact of SARS-CoV-2 vaccine platform-specific priming and immune imprinting.,2025,Raj Kalkeri; Mingzhu Zhu; Shane Cloney-Clark; Anand Parekh; Drew Gorinson; Zhaohui Cai; Miranda R Cai; Soham Mahato; Gordon Chau; Anthony M Marchese; Louis Fries; Lisa M Dunkle; Joyce S Plested,"Novavax, Inc., Gaithersburg, MD, United States. Electronic address: RKalkeri@novavax.com.; Novavax, Inc., Gaithersburg, MD, United States.; Novavax, Inc., Gaithersburg, MD, United States.; Novavax, Inc., Gaithersburg, MD, United States.; Novavax, Inc., Gaithersburg, MD, United States.; Novavax, Inc., Gaithersburg, MD, United States.; Novavax, Inc., Gaithersburg, MD, United States.; Novavax, Inc., Gaithersburg, MD, United States.; Novavax, Inc., Gaithersburg, MD, United States.; Novavax, Inc., Gaithersburg, MD, United States.; Novavax, Inc., Gaithersburg, MD, United States.; Novavax, Inc., Gaithersburg, MD, United States.; Novavax, Inc., Gaithersburg, MD, United States.",RKalkeri@novavax.com
40580944,Lessons from COVID-19 vaccine hesitancy among healthcare workers in West Africa and strategies for future pandemic preparedness: a structured literature review.,2025,Sunday Iphierohor Asasah,"Directorate of Epidemiology, Biosecurity and Global Health, Lagos State Ministry of Health, Secretariat Building, Alausa, Lagos State, Nigeria.",
40578458,Microneedle & film-forming gel transdermal delivery strategy: A novel approach for vaccine delivery.,2025,Sha Guo,"WHO Collaborating Centre for Standardization and Evaluation of Biologicals, State Key Laboratory of Drug Regulatory Science, NHC Key Laboratory of Research on Quality and Standardization of Biotech Products, NMPA Key Laboratory for Quality Research and Evaluation of Biological Products, National Institutes for Food and Drug Control, Beijing, China.",
40577471,"Phase 2/3 study evaluating safety, immunogenicity, and noninferiority of single booster dose of AVX/COVID-12 vaccine.",2025,Martha Torres; Arturo Galindo-Fraga; Claudia Carranza; Esmeralda Juárez; Horacio Zamudio-Meza; Laura E Carreto-Binaghi; Mercedes Viettri; Andrea Palencia,"Laboratorio de Inmunobiología de la Tuberculosis, Instituto Nacional de Enfermedades Respiratorias (INER) ""Ismael Cosío Villegas,"" CDMX, México.; Instituto Nacional de Ciencias Médicas y Nutrición Salvador Zubirán (INCMNSZ), CDMX, México.; Laboratorio de Inmunobiología de la Tuberculosis, Instituto Nacional de Enfermedades Respiratorias (INER) ""Ismael Cosío Villegas,"" CDMX, México.; Departamento de Investigación en Microbiología, INER ""Ismael Cosío Villegas,"" CDMX, México.; Laboratorio de Inmunobiología de la Tuberculosis, Instituto Nacional de Enfermedades Respiratorias (INER) ""Ismael Cosío Villegas,"" CDMX, México.; Laboratorio de Inmunobiología de la Tuberculosis, Instituto Nacional de Enfermedades Respiratorias (INER) ""Ismael Cosío Villegas,"" CDMX, México.; Laboratorio de Inmunobiología de la Tuberculosis, Instituto Nacional de Enfermedades Respiratorias (INER) ""Ismael Cosío Villegas,"" CDMX, México.; Laboratorio de Inmunobiología de la Tuberculosis, Instituto Nacional de Enfermedades Respiratorias (INER) ""Ismael Cosío Villegas,"" CDMX, México.",
40575911,"Hospitalisation trends of respiratory syncytial virus (RSV) infection in adults, six European countries, before and during COVID-19, 2016 to 2023.",2025,Arantxa Urchueguía-Fornes; Caroline Klint Johannesen; Alejandro Orrico-Sánchez,"Vaccine Research Department, Foundation for the Promotion of Health and Biomedical Research in the Valencian Region (FISABIO), Valencia, Spain.; Department of Virology and Microbiological Preparedness, Statens Serum Institut, Copenhagen, Denmark.; Vaccine Research Department, Foundation for the Promotion of Health and Biomedical Research in the Valencian Region (FISABIO), Valencia, Spain.",
40574110,Implications of Anaphylaxis Following mRNA-LNP Vaccines: It Is Urgent to Eliminate PEG and Find Alternatives.,2025,Jinxing Song; Dihan Su; Hongbing Wu; Jeremy Guo,"WuXi Biologics, 190 Hedan Road, Waigaoqiao Free Trade Zone, Shanghai 200131, China.; WuXi Biologics, 190 Hedan Road, Waigaoqiao Free Trade Zone, Shanghai 200131, China.; WuXi Biologics, 190 Hedan Road, Waigaoqiao Free Trade Zone, Shanghai 200131, China.; WuXi Biologics, 190 Hedan Road, Waigaoqiao Free Trade Zone, Shanghai 200131, China.",
